{
  "schema_version": "numeric-calendar-v1",
  "calendar_id": "synthetic-xnys-2025-q1",
  "exchange": "XNYS",
  "coverage_start": "2025-01-02",
  "coverage_end": "2025-04-11",
  "sessions": [
    {
      "session": "2025-01-02",
      "open_at": "2025-01-02T14:30:00Z",
      "close_at": "2025-01-02T21:00:00Z"
    },
    {
      "session": "2025-01-03",
      "open_at": "2025-01-03T14:30:00Z",
      "close_at": "2025-01-03T21:00:00Z"
    },
    {
      "session": "2025-01-06",
      "open_at": "2025-01-06T14:30:00Z",
      "close_at": "2025-01-06T21:00:00Z"
    },
    {
      "session": "2025-01-07",
      "open_at": "2025-01-07T14:30:00Z",
      "close_at": "2025-01-07T21:00:00Z"
    },
    {
      "session": "2025-01-08",
      "open_at": "2025-01-08T14:30:00Z",
      "close_at": "2025-01-08T21:00:00Z"
    },
    {
      "session": "2025-01-10",
      "open_at": "2025-01-10T14:30:00Z",
      "close_at": "2025-01-10T21:00:00Z"
    },
    {
      "session": "2025-01-13",
      "open_at": "2025-01-13T14:30:00Z",
      "close_at": "2025-01-13T21:00:00Z"
    },
    {
      "session": "2025-01-14",
      "open_at": "2025-01-14T14:30:00Z",
      "close_at": "2025-01-14T21:00:00Z"
    },
    {
      "session": "2025-01-15",
      "open_at": "2025-01-15T14:30:00Z",
      "close_at": "2025-01-15T21:00:00Z"
    },
    {
      "session": "2025-01-16",
      "open_at": "2025-01-16T14:30:00Z",
      "close_at": "2025-01-16T21:00:00Z"
    },
    {
      "session": "2025-01-17",
      "open_at": "2025-01-17T14:30:00Z",
      "close_at": "2025-01-17T21:00:00Z"
    },
    {
      "session": "2025-01-21",
      "open_at": "2025-01-21T14:30:00Z",
      "close_at": "2025-01-21T21:00:00Z"
    },
    {
      "session": "2025-01-22",
      "open_at": "2025-01-22T14:30:00Z",
      "close_at": "2025-01-22T21:00:00Z"
    },
    {
      "session": "2025-01-23",
      "open_at": "2025-01-23T14:30:00Z",
      "close_at": "2025-01-23T21:00:00Z"
    },
    {
      "session": "2025-01-24",
      "open_at": "2025-01-24T14:30:00Z",
      "close_at": "2025-01-24T21:00:00Z"
    },
    {
      "session": "2025-01-27",
      "open_at": "2025-01-27T14:30:00Z",
      "close_at": "2025-01-27T21:00:00Z"
    },
    {
      "session": "2025-01-28",
      "open_at": "2025-01-28T14:30:00Z",
      "close_at": "2025-01-28T21:00:00Z"
    },
    {
      "session": "2025-01-29",
      "open_at": "2025-01-29T14:30:00Z",
      "close_at": "2025-01-29T21:00:00Z"
    },
    {
      "session": "2025-01-30",
      "open_at": "2025-01-30T14:30:00Z",
      "close_at": "2025-01-30T21:00:00Z"
    },
    {
      "session": "2025-01-31",
      "open_at": "2025-01-31T14:30:00Z",
      "close_at": "2025-01-31T21:00:00Z"
    },
    {
      "session": "2025-02-03",
      "open_at": "2025-02-03T14:30:00Z",
      "close_at": "2025-02-03T21:00:00Z"
    },
    {
      "session": "2025-02-04",
      "open_at": "2025-02-04T14:30:00Z",
      "close_at": "2025-02-04T21:00:00Z"
    },
    {
      "session": "2025-02-05",
      "open_at": "2025-02-05T14:30:00Z",
      "close_at": "2025-02-05T21:00:00Z"
    },
    {
      "session": "2025-02-06",
      "open_at": "2025-02-06T14:30:00Z",
      "close_at": "2025-02-06T21:00:00Z"
    },
    {
      "session": "2025-02-07",
      "open_at": "2025-02-07T14:30:00Z",
      "close_at": "2025-02-07T21:00:00Z"
    },
    {
      "session": "2025-02-10",
      "open_at": "2025-02-10T14:30:00Z",
      "close_at": "2025-02-10T21:00:00Z"
    },
    {
      "session": "2025-02-11",
      "open_at": "2025-02-11T14:30:00Z",
      "close_at": "2025-02-11T21:00:00Z"
    },
    {
      "session": "2025-02-12",
      "open_at": "2025-02-12T14:30:00Z",
      "close_at": "2025-02-12T21:00:00Z"
    },
    {
      "session": "2025-02-13",
      "open_at": "2025-02-13T14:30:00Z",
      "close_at": "2025-02-13T21:00:00Z"
    },
    {
      "session": "2025-02-14",
      "open_at": "2025-02-14T14:30:00Z",
      "close_at": "2025-02-14T21:00:00Z"
    },
    {
      "session": "2025-02-18",
      "open_at": "2025-02-18T14:30:00Z",
      "close_at": "2025-02-18T21:00:00Z"
    },
    {
      "session": "2025-02-19",
      "open_at": "2025-02-19T14:30:00Z",
      "close_at": "2025-02-19T21:00:00Z"
    },
    {
      "session": "2025-02-20",
      "open_at": "2025-02-20T14:30:00Z",
      "close_at": "2025-02-20T21:00:00Z"
    },
    {
      "session": "2025-02-21",
      "open_at": "2025-02-21T14:30:00Z",
      "close_at": "2025-02-21T21:00:00Z"
    },
    {
      "session": "2025-02-24",
      "open_at": "2025-02-24T14:30:00Z",
      "close_at": "2025-02-24T21:00:00Z"
    },
    {
      "session": "2025-02-25",
      "open_at": "2025-02-25T14:30:00Z",
      "close_at": "2025-02-25T21:00:00Z"
    },
    {
      "session": "2025-02-26",
      "open_at": "2025-02-26T14:30:00Z",
      "close_at": "2025-02-26T21:00:00Z"
    },
    {
      "session": "2025-02-27",
      "open_at": "2025-02-27T14:30:00Z",
      "close_at": "2025-02-27T21:00:00Z"
    },
    {
      "session": "2025-02-28",
      "open_at": "2025-02-28T14:30:00Z",
      "close_at": "2025-02-28T21:00:00Z"
    },
    {
      "session": "2025-03-03",
      "open_at": "2025-03-03T14:30:00Z",
      "close_at": "2025-03-03T21:00:00Z"
    },
    {
      "session": "2025-03-04",
      "open_at": "2025-03-04T14:30:00Z",
      "close_at": "2025-03-04T21:00:00Z"
    },
    {
      "session": "2025-03-05",
      "open_at": "2025-03-05T14:30:00Z",
      "close_at": "2025-03-05T21:00:00Z"
    },
    {
      "session": "2025-03-06",
      "open_at": "2025-03-06T14:30:00Z",
      "close_at": "2025-03-06T21:00:00Z"
    },
    {
      "session": "2025-03-07",
      "open_at": "2025-03-07T14:30:00Z",
      "close_at": "2025-03-07T21:00:00Z"
    },
    {
      "session": "2025-03-10",
      "open_at": "2025-03-10T13:30:00Z",
      "close_at": "2025-03-10T20:00:00Z"
    },
    {
      "session": "2025-03-11",
      "open_at": "2025-03-11T13:30:00Z",
      "close_at": "2025-03-11T20:00:00Z"
    },
    {
      "session": "2025-03-12",
      "open_at": "2025-03-12T13:30:00Z",
      "close_at": "2025-03-12T20:00:00Z"
    },
    {
      "session": "2025-03-13",
      "open_at": "2025-03-13T13:30:00Z",
      "close_at": "2025-03-13T20:00:00Z"
    },
    {
      "session": "2025-03-14",
      "open_at": "2025-03-14T13:30:00Z",
      "close_at": "2025-03-14T20:00:00Z"
    },
    {
      "session": "2025-03-17",
      "open_at": "2025-03-17T13:30:00Z",
      "close_at": "2025-03-17T20:00:00Z"
    },
    {
      "session": "2025-03-18",
      "open_at": "2025-03-18T13:30:00Z",
      "close_at": "2025-03-18T20:00:00Z"
    },
    {
      "session": "2025-03-19",
      "open_at": "2025-03-19T13:30:00Z",
      "close_at": "2025-03-19T20:00:00Z"
    },
    {
      "session": "2025-03-20",
      "open_at": "2025-03-20T13:30:00Z",
      "close_at": "2025-03-20T20:00:00Z"
    },
    {
      "session": "2025-03-21",
      "open_at": "2025-03-21T13:30:00Z",
      "close_at": "2025-03-21T20:00:00Z"
    },
    {
      "session": "2025-03-24",
      "open_at": "2025-03-24T13:30:00Z",
      "close_at": "2025-03-24T20:00:00Z"
    },
    {
      "session": "2025-03-25",
      "open_at": "2025-03-25T13:30:00Z",
      "close_at": "2025-03-25T20:00:00Z"
    },
    {
      "session": "2025-03-26",
      "open_at": "2025-03-26T13:30:00Z",
      "close_at": "2025-03-26T20:00:00Z"
    },
    {
      "session": "2025-03-27",
      "open_at": "2025-03-27T13:30:00Z",
      "close_at": "2025-03-27T20:00:00Z"
    },
    {
      "session": "2025-03-28",
      "open_at": "2025-03-28T13:30:00Z",
      "close_at": "2025-03-28T20:00:00Z"
    },
    {
      "session": "2025-03-31",
      "open_at": "2025-03-31T13:30:00Z",
      "close_at": "2025-03-31T20:00:00Z"
    },
    {
      "session": "2025-04-01",
      "open_at": "2025-04-01T13:30:00Z",
      "close_at": "2025-04-01T20:00:00Z"
    },
    {
      "session": "2025-04-02",
      "open_at": "2025-04-02T13:30:00Z",
      "close_at": "2025-04-02T20:00:00Z"
    },
    {
      "session": "2025-04-03",
      "open_at": "2025-04-03T13:30:00Z",
      "close_at": "2025-04-03T20:00:00Z"
    },
    {
      "session": "2025-04-04",
      "open_at": "2025-04-04T13:30:00Z",
      "close_at": "2025-04-04T20:00:00Z"
    },
    {
      "session": "2025-04-07",
      "open_at": "2025-04-07T13:30:00Z",
      "close_at": "2025-04-07T20:00:00Z"
    },
    {
      "session": "2025-04-08",
      "open_at": "2025-04-08T13:30:00Z",
      "close_at": "2025-04-08T20:00:00Z"
    },
    {
      "session": "2025-04-09",
      "open_at": "2025-04-09T13:30:00Z",
      "close_at": "2025-04-09T20:00:00Z"
    },
    {
      "session": "2025-04-10",
      "open_at": "2025-04-10T13:30:00Z",
      "close_at": "2025-04-10T20:00:00Z"
    },
    {
      "session": "2025-04-11",
      "open_at": "2025-04-11T13:30:00Z",
      "close_at": "2025-04-11T20:00:00Z"
    }
  ],
  "calendar_sha256": "787b5dc9146bbcfb410215bf1e103d7e645f3877a2d92248faa46ed776b65034"
}
